{
  "esquema": "panlabs-aws-diagrams/sessao@1",
  "id": "silos-telemetria",
  "titulo": "Cooperativa · telemetria de silos",
  "estagio": "logica",
  "vistas": {
    "logica": {
      "genero": "L2",
      "titulo": "Cooperativa · telemetria de silos · vista lógica",
      "subtitulo": "Capacidades e fronteiras de responsabilidade — zero nome de serviço AWS. Esta é a vista que o conselho aprovou."
    },
    "tecnica": {
      "genero": "T3",
      "titulo": "Cooperativa · telemetria de silos · vista técnica",
      "subtitulo": "T3 event-driven · a MESMA vista aprovada, agora com serviços AWS e o leque assíncrono explícito."
    }
  },
  "nos": [
    {
      "id": "silo",
      "rotulo": "Silos",
      "logico": {
        "tipo": "ator",
        "nota": "1.200 silos, leitura a cada 5 min"
      }
    },
    {
      "id": "agronomo",
      "rotulo": "Agrônomos",
      "logico": {
        "tipo": "ator",
        "nota": "18 técnicos de campo"
      }
    },
    {
      "id": "cooperado",
      "rotulo": "Cooperados",
      "logico": {
        "tipo": "ator",
        "nota": "2.400 produtores"
      }
    },
    {
      "id": "campo",
      "rotulo": "Campo",
      "logico": {
        "tipo": "grupo",
        "nota": "dono: engenharia agrícola"
      }
    },
    {
      "id": "plataforma",
      "rotulo": "Plataforma",
      "logico": {
        "tipo": "grupo",
        "nota": "dono: TI da cooperativa"
      }
    },
    {
      "id": "atendimento",
      "rotulo": "Atendimento",
      "logico": {
        "tipo": "grupo",
        "nota": "dono: relacionamento"
      }
    },
    {
      "id": "receber-leitura",
      "rotulo": "Receber leitura",
      "dentro": "campo",
      "logico": {
        "tipo": "bloco",
        "nota": "umidade, temperatura, CO₂"
      }
    },
    {
      "id": "guardar-serie",
      "rotulo": "Guardar a série",
      "dentro": "plataforma",
      "logico": {
        "tipo": "bloco",
        "nota": "retenção de 5 safras"
      }
    },
    {
      "id": "detectar-risco",
      "rotulo": "Detectar risco de perda",
      "dentro": "plataforma",
      "logico": {
        "tipo": "bloco",
        "nota": "umidade acima da faixa por 40 min"
      }
    },
    {
      "id": "publicar-evento",
      "rotulo": "Publicar o evento de risco",
      "dentro": "plataforma",
      "logico": {
        "tipo": "bloco",
        "nota": "um evento, três interessados"
      }
    },
    {
      "id": "alertar-tecnico",
      "rotulo": "Alertar o técnico",
      "dentro": "atendimento",
      "logico": {
        "tipo": "bloco",
        "nota": "push e SMS, plantão 24h"
      }
    },
    {
      "id": "abrir-visita",
      "rotulo": "Abrir visita técnica",
      "dentro": "atendimento",
      "logico": {
        "tipo": "bloco",
        "nota": "agenda o agrônomo mais próximo"
      }
    },
    {
      "id": "painel-semanal",
      "rotulo": "Painel do cooperado",
      "dentro": "atendimento",
      "logico": {
        "tipo": "bloco",
        "nota": "consolidado semanal por silo"
      }
    }
  ],
  "arestas": [
    {
      "id": "a-le",
      "de": "silo",
      "para": "receber-leitura",
      "rotulo": "envia a leitura",
      "ordem": 1
    },
    {
      "id": "a-guarda",
      "de": "receber-leitura",
      "para": "guardar-serie",
      "rotulo": "grava a série",
      "ordem": 2
    },
    {
      "id": "a-detecta",
      "de": "guardar-serie",
      "para": "detectar-risco",
      "rotulo": "avalia a janela",
      "ordem": 3
    },
    {
      "id": "a-publica",
      "de": "detectar-risco",
      "para": "publicar-evento",
      "rotulo": "risco encontrado",
      "ordem": 4
    },
    {
      "id": "a-alerta",
      "de": "publicar-evento",
      "para": "alertar-tecnico",
      "rotulo": "avisa o plantão",
      "ordem": 5
    },
    {
      "id": "a-visita",
      "de": "publicar-evento",
      "para": "abrir-visita",
      "rotulo": "agenda a visita",
      "ordem": 6
    },
    {
      "id": "a-painel",
      "de": "publicar-evento",
      "para": "painel-semanal",
      "rotulo": "alimenta o painel",
      "ordem": 7
    },
    {
      "id": "a-tec",
      "de": "agronomo",
      "para": "abrir-visita",
      "rotulo": "confirma ou remarca",
      "dados": "ambos"
    },
    {
      "id": "a-coop",
      "de": "cooperado",
      "para": "painel-semanal",
      "rotulo": "consulta",
      "dados": "volta"
    }
  ],
  "notas": [
    {
      "id": "n-fronteira",
      "origem": "premissa",
      "texto": "Os três grupos são fronteiras de RESPONSABILIDADE, não contas AWS. Esta vista foi ao conselho da cooperativa, que não é gente de TI."
    },
    {
      "id": "n-dlq",
      "origem": "achado-recusado",
      "sobre": "painel-semanal",
      "texto": "Ramo do painel sem fila morta, conhecido e aceito: perder um evento adia um número no consolidado semanal, e o próximo evento corrige. Os ramos de alerta e visita têm fila morta desde a v1."
    }
  ],
  "dossie": {
    "fatos": [
      {
        "fato": "1.200 silos em 34 unidades armazenadoras, leitura a cada 5 minutos",
        "procedencia": "perguntado",
        "confirmado": true
      },
      {
        "fato": "a perda por umidade custou R$ 4,1 mi na safra passada",
        "procedencia": "perguntado",
        "confirmado": true
      },
      {
        "fato": "não há time de infraestrutura — dois desenvolvedores, meio período",
        "procedencia": "perguntado",
        "confirmado": true
      },
      {
        "fato": "o sensor é 4G e reenvia sozinho por até 6 horas se cair o link",
        "procedencia": "inferido",
        "de": "ficha técnica do sensor anexada na ata",
        "confirmado": true
      },
      {
        "fato": "o técnico precisa ser avisado em menos de 15 minutos",
        "procedencia": "perguntado",
        "confirmado": true
      },
      {
        "fato": "o painel do cooperado é semanal — ninguém olha diariamente",
        "procedencia": "inferido",
        "de": "\"o pessoal abre o relatório na segunda de manhã\"",
        "confirmado": true
      },
      {
        "fato": "retenção de 5 safras para comparar ano a ano",
        "procedencia": "perguntado",
        "confirmado": true
      }
    ],
    "candidatas": [
      {
        "id": "cand-a",
        "nome": "Leque assíncrono por evento",
        "estado": "escolhida",
        "tupla": [
          "gerenciado-sem-compute",
          "evento",
          "serie-temporal",
          "privado",
          "tres-fronteiras"
        ],
        "compra": "cada consumidor do evento de risco evolui sozinho, e um ramo cair não derruba os outros",
        "paga": "três caminhos para observar em vez de um; a ordem entre alerta e visita não é garantida",
        "escolhaSe": "os consumidores do evento crescem — e vão crescer: seguro agrícola e compra de insumo já foram citados",
        "erradaSe": "o alerta e a visita tivessem de ser transacionais entre si"
      },
      {
        "id": "cand-b",
        "nome": "Cadeia síncrona única",
        "estado": "descartada",
        "tupla": [
          "gerenciado-sem-compute",
          "sincrono-em-cadeia",
          "serie-temporal",
          "privado",
          "tres-fronteiras"
        ],
        "difereEm": [
          "E2"
        ],
        "compra": "uma linha só para depurar, ordem garantida entre alerta e visita",
        "paga": "acoplamento — o painel fora do ar segura o alerta ao técnico, que é o que não pode atrasar",
        "escolhaSe": "a ordem entre os três consumidores fosse requisito",
        "erradaSe": "algum consumidor for mais lento ou menos disponível que o alerta",
        "porque": "o painel semanal é o ramo mais lento e o menos crítico; pô-lo na mesma cadeia do alerta de 15 minutos inverte a prioridade"
      },
      {
        "id": "cand-c",
        "nome": "Lote de hora em hora",
        "estado": "descartada",
        "tupla": [
          "gerenciado-sem-compute",
          "lote-agendado",
          "serie-temporal",
          "privado",
          "duas-fronteiras"
        ],
        "difereEm": [
          "E2",
          "E5"
        ],
        "compra": "o mais barato e o mais simples de operar com dois desenvolvedores",
        "paga": "até 60 minutos de atraso no alerta",
        "escolhaSe": "o requisito de 15 minutos não existisse",
        "erradaSe": "a perda por umidade acelerar dentro da janela de uma hora",
        "porque": "o requisito de 15 minutos é o motivo do projeto; um lote horário o contradiz na primeira linha"
      }
    ],
    "achados": [
      {
        "regra": "assincrono-sem-dlq",
        "alvo": "painel-semanal",
        "estado": "recusado",
        "em": "2026-08-23",
        "viaNota": "n-dlq",
        "nota": "aceito: perder um evento adia um número no consolidado, e o próximo corrige"
      },
      {
        "regra": "spof",
        "alvo": "receber-leitura",
        "estado": "aceito",
        "em": "2026-08-23",
        "nota": "consertado antes do desenho: o sensor reenvia por até 6 h, então a recepção não é ponto único de perda"
      }
    ],
    "estacionamento": [
      {
        "nome": "IoT Core",
        "capacidade": "receber-leitura",
        "estado": "estacionado",
        "nota": "dito no minuto dois da primeira reunião"
      },
      {
        "nome": "Timestream",
        "capacidade": "guardar-serie",
        "estado": "estacionado",
        "nota": "\"acho que dava pra usar Timestream\" — hedge, entrou como opção"
      },
      {
        "nome": "QuickSight",
        "capacidade": "painel-semanal",
        "estado": "estacionado",
        "nota": "o gerente já tem licença"
      }
    ]
  }
}