{
  "esquema": "panlabs-aws-diagrams/sessao@1",
  "id": "frota-preditiva",
  "titulo": "Frota · manutenção preditiva",
  "estagio": "logica",
  "vistas": {
    "logica": {
      "genero": "L2",
      "titulo": "Frota · manutenção preditiva · vista lógica",
      "subtitulo": "Capacidades e fronteiras de responsabilidade — zero nome de serviço AWS. O caso ponta a ponta do #26."
    },
    "tecnica": {
      "genero": "T3",
      "titulo": "Frota · manutenção preditiva · vista técnica",
      "subtitulo": "T3 event-driven · a MESMA vista aprovada, agora com serviços AWS e um nível de rede que a lógica não tem."
    }
  },
  "nos": [
    {
      "id": "veiculo",
      "rotulo": "Caminhões",
      "logico": {
        "tipo": "ator",
        "nota": "1.200 veículos, telemetria a cada 30 s"
      }
    },
    {
      "id": "oficina",
      "rotulo": "Oficinas",
      "logico": {
        "tipo": "ator",
        "nota": "34 pontos próprios"
      }
    },
    {
      "id": "coleta",
      "rotulo": "Coleta",
      "logico": {
        "tipo": "grupo",
        "nota": "dono: engenharia embarcada"
      }
    },
    {
      "id": "analise",
      "rotulo": "Análise",
      "logico": {
        "tipo": "grupo",
        "nota": "dono: time de dados"
      }
    },
    {
      "id": "acao",
      "rotulo": "Ação",
      "logico": {
        "tipo": "grupo",
        "nota": "dono: operações de frota"
      }
    },
    {
      "id": "receber-telemetria",
      "rotulo": "Recepção de telemetria",
      "dentro": "coleta",
      "logico": {
        "tipo": "bloco",
        "nota": "aceita lote e tempo real"
      }
    },
    {
      "id": "guardar-serie",
      "rotulo": "Série histórica",
      "dentro": "coleta",
      "logico": {
        "tipo": "bloco",
        "nota": "dois anos, consultável por veículo"
      }
    },
    {
      "id": "detectar-anomalia",
      "rotulo": "Detecção de anomalia",
      "dentro": "analise",
      "logico": {
        "tipo": "bloco",
        "nota": "regra simples sobre a janela"
      }
    },
    {
      "id": "pontuar-risco",
      "rotulo": "Pontuação de risco",
      "dentro": "analise",
      "logico": {
        "tipo": "bloco",
        "nota": "modelo treinado, roda por veículo"
      }
    },
    {
      "id": "abrir-ordem",
      "rotulo": "Abertura de ordem",
      "dentro": "acao",
      "logico": {
        "tipo": "bloco",
        "nota": "só acima do corte de risco"
      }
    },
    {
      "id": "avisar-oficina",
      "rotulo": "Aviso à oficina",
      "dentro": "acao",
      "logico": {
        "tipo": "bloco",
        "nota": "canal único, com confirmação"
      }
    }
  ],
  "arestas": [
    {
      "id": "a-envia",
      "de": "veiculo",
      "para": "receber-telemetria",
      "rotulo": "envia telemetria",
      "ordem": 1
    },
    {
      "id": "a-grava",
      "de": "receber-telemetria",
      "para": "guardar-serie",
      "rotulo": "grava a série",
      "ordem": 2
    },
    {
      "id": "a-le",
      "de": "detectar-anomalia",
      "para": "guardar-serie",
      "rotulo": "lê a janela",
      "dados": "volta",
      "ordem": 3
    },
    {
      "id": "a-pontua",
      "de": "detectar-anomalia",
      "para": "pontuar-risco",
      "rotulo": "anomalia encontrada",
      "ordem": 4
    },
    {
      "id": "a-abre",
      "de": "pontuar-risco",
      "para": "abrir-ordem",
      "rotulo": "risco acima do corte",
      "ordem": 5
    },
    {
      "id": "a-avisa",
      "de": "abrir-ordem",
      "para": "avisar-oficina",
      "rotulo": "ordem aberta",
      "ordem": 6
    },
    {
      "id": "a-alerta",
      "de": "avisar-oficina",
      "para": "oficina",
      "rotulo": "alerta com prazo",
      "ordem": 7
    }
  ],
  "notas": [
    {
      "id": "n-fronteira",
      "origem": "premissa",
      "texto": "Os três grupos são fronteiras de RESPONSABILIDADE, não contas AWS (#15 §6). Esta vista foi a que a diretoria aprovou."
    },
    {
      "id": "n-spof",
      "origem": "achado-recusado",
      "sobre": "receber-telemetria",
      "texto": "Ponto único de recepção conhecido e aceito: um caminho de entrada só, sem par. A frota tolera 30 min de buffer no veículo, e o time aceitou para a fase 1 (2026-08)."
    }
  ],
  "dossie": {
    "fatos": [
      {
        "fato": "1.200 veículos, telemetria a cada 30 s",
        "procedencia": "perguntado",
        "confirmado": true
      },
      {
        "fato": "o caminhão guarda 30 min de leitura se perder o link",
        "procedencia": "perguntado",
        "confirmado": true
      },
      {
        "fato": "a oficina precisa de 48 h de antecedência para agendar",
        "procedencia": "perguntado",
        "confirmado": true
      },
      {
        "fato": "hoje a manutenção é por quilometragem, não por condição",
        "procedencia": "perguntado",
        "confirmado": true
      },
      {
        "fato": "não há requisito de multi-região",
        "procedencia": "inferido",
        "confirmado": true,
        "de": "\"a operação é só Brasil\", na ata da reunião de 12/08"
      },
      {
        "fato": "a série tem de durar dois anos para treinar o modelo",
        "procedencia": "inferido",
        "confirmado": true,
        "de": "\"o pessoal de dados falou em dois ciclos de revisão\""
      }
    ],
    "candidatas": [
      {
        "id": "cand-a",
        "nome": "Fluxo contínuo com pontuação por veículo",
        "estado": "escolhida",
        "tupla": [
          "gerenciado-sem-compute",
          "evento",
          "serie-temporal",
          "privado",
          "tres-fronteiras"
        ],
        "compra": "o alerta sai minutos depois da leitura, que é o que a antecedência de 48 h exige",
        "paga": "custo por evento, e um modelo que precisa ser retreinado",
        "escolhaSe": "a antecedência importa mais que o custo por leitura",
        "erradaSe": "a frota crescer para dezenas de milhares e o custo por evento dominar"
      },
      {
        "id": "cand-b",
        "nome": "Lote noturno sobre a série",
        "estado": "descartada",
        "tupla": [
          "gerenciado-sem-compute",
          "lote-agendado",
          "serie-temporal",
          "privado",
          "tres-fronteiras"
        ],
        "difereEm": [
          "E2"
        ],
        "compra": "custo muito menor e operação mais simples",
        "paga": "até 24 h de atraso entre a leitura e o alerta",
        "escolhaSe": "48 h de antecedência forem folgadas",
        "erradaSe": "a falha se desenvolver em menos de um dia",
        "porque": "a antecedência de 48 h não sobrevive a um atraso de até 24 h — sobra meio dia para a oficina agendar, e o fato perguntado diz que não dá."
      },
      {
        "id": "cand-c",
        "nome": "Pontuação no próprio veículo",
        "estado": "descartada",
        "tupla": [
          "computacao-na-borda",
          "evento",
          "serie-temporal",
          "hibrido",
          "duas-fronteiras"
        ],
        "difereEm": [
          "E1",
          "E4",
          "E5"
        ],
        "compra": "funciona sem link, e manda só o alerta em vez da série inteira",
        "paga": "atualizar modelo em 1.200 veículos, e perder a série que treina o próximo",
        "escolhaSe": "a conectividade for ruim a ponto de a série não chegar",
        "erradaSe": "for preciso retreinar com frequência",
        "porque": "o fato de que a série tem de durar dois anos para treinar mata a variante: pontuar na borda e não trazer a leitura joga fora exatamente o insumo do modelo."
      }
    ],
    "achados": [
      {
        "regra": "spof",
        "alvo": "receber-telemetria",
        "estado": "recusado",
        "em": "2026-08-23",
        "viaNota": "n-spof",
        "nota": "sem par, e é o único caminho do caminhão até 5 outros componentes. Aceito: o veículo tem 30 min de buffer."
      },
      {
        "regra": "spof",
        "alvo": "avisar-oficina",
        "estado": "aceito",
        "em": "2026-08-23",
        "nota": "o outro extremo da cadeia, visto da oficina: um canal de aviso só. Vira tópico gerenciado na fase técnica, com entrega a múltiplos assinantes — deixa de ser ponto único sem mudar a vista lógica."
      }
    ],
    "estacionamento": [
      {
        "nome": "Kinesis",
        "capacidade": "receber-telemetria",
        "estado": "estacionado",
        "nota": "dito no primeiro minuto da reunião. Volta na fase técnica como sugestão inferida."
      },
      {
        "nome": "SageMaker",
        "capacidade": "pontuar-risco",
        "estado": "estacionado",
        "nota": "dito junto, e pela mesma razão fica fora da vista lógica."
      }
    ]
  }
}
